{
  "schema_version": "2.0",
  "plan_id": "paid-invoice-total-locals",
  "scope": ["src/invoices.py"],
  "authorization": {
    "mode": "refactor",
    "migration_authorized": false,
    "maximum_changed_symbols": 1
  },
  "analysis": {
    "methods": ["ast", "text-search"],
    "reference_coverage": "complete",
    "dynamic_surfaces_checked": []
  },
  "records": [
    {
      "symbol_id": "src/invoices.py:18:result",
      "identifier": "result",
      "symbol_kind": "local",
      "location": "src/invoices.py:18",
      "meaning": {
        "concept": "paid invoice total",
        "role": "accumulator",
        "state": "final after loop",
        "representation": "integer",
        "cardinality": "single aggregate",
        "unit_or_basis": "cents",
        "ownership_or_trust": null,
        "effect": null,
        "scope": "function local"
      },
      "evidence": [
        {
          "source": "assignment and loop predicate",
          "fact": "adds amount_in_cents only when invoice status is paid"
        }
      ],
      "wrong_read": "result could be read as any output and hides both paid-state and cents",
      "materiality": "material",
      "decision": "rename",
      "proposed_name": "paid_invoice_total_cents",
      "confidence": "high",
      "contract_risk": "internal",
      "protected_spellings": [],
      "unresolved_surfaces": []
    }
  ],
  "verification": {
    "commands": ["python -m unittest tests.test_invoices"],
    "contract_checks": [],
    "collision_checks": ["AST scope scan confirms the proposed local is unique"],
    "rollback_commands": []
  }
}
